{
  "schema_version": "1.0.0",
  "artifact_type": "evidence-bundle",
  "id": "EB-0001",
  "created_at": "2026-09-23T10:05:00Z",
  "actor": { "type": "ci", "id": "deploy-verify", "role": "release-approver" },
  "run_id": "RUN-release-0001",
  "image": "ghcr.io/yunecque/ai_dev_project/domain:abc123",
  "candidate_digest": "3333333333333333333333333333333333333333333333333333333333333333",
  "bundle_digest": "4444444444444444444444444444444444444444444444444444444444444444",
  "items": [
    { "kind": "signature", "ref": "candidate:signature", "digest": "5555555555555555555555555555555555555555555555555555555555555555" },
    { "kind": "sbom", "ref": "candidate:sbom", "digest": "6666666666666666666666666666666666666666666666666666666666666666" },
    { "kind": "provenance", "ref": "candidate:provenance", "digest": "7777777777777777777777777777777777777777777777777777777777777777" },
    { "kind": "policy-decision", "ref": "artifact-transition", "digest": "8888888888888888888888888888888888888888888888888888888888888888" },
    { "kind": "policy-decision", "ref": "pr-ci", "digest": "9999999999999999999999999999999999999999999999999999999999999999" },
    { "kind": "approval", "ref": "release-approver:yunecque", "digest": "aaaaaaaaaaaaaaaaaaaaaaaaaaaaaaaaaaaaaaaaaaaaaaaaaaaaaaaaaaaaaaaa" }
  ],
  "policy_decision_ref": "specs/examples/policy-decision.json",
  "links": [
    { "rel": "policy-decision", "href": "specs/examples/policy-decision.json" }
  ]
}
